{
  "id": "card-default",
  "entries": {
    "light": {
      "base": {
        "l": 0.9,
        "c": 0.06,
        "h": 100
      },
      "text": {
        "l": 0.18,
        "c": 0.03,
        "h": 260
      }
    },
    "shadow": {
      "base": {
        "l": 0.2,
        "c": 0.04,
        "h": 260
      },
      "text": {
        "l": 0.88,
        "c": 0.03,
        "h": 100
      }
    },
    "heart": {
      "base": {
        "l": 0.7,
        "c": 0.2,
        "h": 25
      },
      "text": {
        "l": 0.12,
        "c": 0.03,
        "h": 260
      }
    },
    "spirit": {
      "base": {
        "l": 0.72,
        "c": 0.14,
        "h": 280
      },
      "text": {
        "l": 0.12,
        "c": 0.03,
        "h": 260
      }
    }
  },
  "bg": {
    "l": 0.93,
    "c": 0.02,
    "h": 100
  },
  "walls": {
    "l": 0.8,
    "c": 0.04,
    "h": 240
  }
}